{
  "feature": "database-schema-and-migrations",
  "version": 1,
  "architecture": {
    "approach": "The tenancy half of the schema is already shipped and migrated, so this plan adds the clinical half in one additive migration, keeps the in-memory test double in step, and produces the demo dataset. Patient, Doctor and Appointment land together because they reference each other; splitting them would mean three migrations with no value. The migration is pure DDL - CREATE TABLE, CREATE INDEX, foreign keys - with no DROP, no TRUNCATE and no rewrite of an existing table, which is what makes the additive guarantee provable on a populated database. The test double is part of the change rather than cleanup: adding models to schema.prisma without teaching memory-prisma leaves the API suite unable to construct a patient or appointment. The seed is deterministic and idempotent with no new dependency - a small seeded PRNG plus upserts on natural keys.",
    "components": [
      {
        "name": "server/prisma/schema.prisma",
        "action": "modify",
        "description": "Add Patient, Doctor, Appointment and the AppointmentStatus enum, plus @@index([doctorId, startsAt]) and @@index([patientId]). The eight existing models are untouched."
      },
      {
        "name": "server/prisma/migrations",
        "action": "create",
        "description": "A new migration folder generated by prisma migrate dev, containing only additive DDL for the three tables, their foreign keys and the two indexes."
      },
      {
        "name": "server/src/database/memory-prisma.ts",
        "action": "modify",
        "description": "Add the three clinical collections and their query surface so the in-memory path the API tests use matches the schema."
      },
      {
        "name": "server/src/database/seeds/seed.ts",
        "action": "modify",
        "description": "Add the deterministic clinical seed after the existing user seed, using upserts on natural keys, with a NODE_ENV guard and a CON-506 fixtures-only warning."
      },
      {
        "name": "server/prisma/ERD.md",
        "action": "create",
        "description": "Mermaid erDiagram covering the clinical models, their relations to Clinic and to each other, and the two indexes."
      },
      {
        "name": "server/package.json",
        "action": "reuse",
        "description": "The seed script already runs the seed file; no change is needed."
      }
    ],
    "referencedRequirementIds": [
      "FR-001",
      "FR-002",
      "FR-003",
      "FR-004",
      "FR-005",
      "FR-006",
      "FR-007",
      "FR-008",
      "NFR-001",
      "NFR-002",
      "NFR-003",
      "NFR-004"
    ]
  },
  "dataModel": {
    "entities": [
      {
        "name": "Patient",
        "action": "create",
        "fields": [
          { "name": "id", "type": "String", "action": "add" },
          { "name": "clinicId", "type": "String", "action": "add" },
          { "name": "firstName", "type": "String", "action": "add" },
          { "name": "lastName", "type": "String", "action": "add" },
          { "name": "dateOfBirth", "type": "DateTime", "action": "add" },
          { "name": "phone", "type": "String", "action": "add" },
          { "name": "email", "type": "String", "nullable": true, "action": "add" },
          { "name": "gender", "type": "String", "nullable": true, "action": "add" },
          { "name": "createdAt", "type": "DateTime", "action": "add" },
          { "name": "updatedAt", "type": "DateTime", "action": "add" }
        ]
      },
      {
        "name": "Doctor",
        "action": "create",
        "fields": [
          { "name": "id", "type": "String", "action": "add" },
          { "name": "clinicId", "type": "String", "action": "add" },
          { "name": "userId", "type": "String", "nullable": true, "action": "add" },
          { "name": "specialty", "type": "String", "action": "add" },
          { "name": "licenseNumber", "type": "String", "nullable": true, "action": "add" },
          { "name": "consultationMinutes", "type": "Int", "action": "add" },
          { "name": "isActive", "type": "Boolean", "action": "add" },
          { "name": "createdAt", "type": "DateTime", "action": "add" },
          { "name": "updatedAt", "type": "DateTime", "action": "add" }
        ]
      },
      {
        "name": "Appointment",
        "action": "create",
        "fields": [
          { "name": "id", "type": "String", "action": "add" },
          { "name": "clinicId", "type": "String", "action": "add" },
          { "name": "patientId", "type": "String", "action": "add" },
          { "name": "doctorId", "type": "String", "action": "add" },
          { "name": "startsAt", "type": "DateTime", "action": "add" },
          { "name": "endsAt", "type": "DateTime", "action": "add" },
          { "name": "status", "type": "AppointmentStatus", "action": "add" },
          { "name": "reason", "type": "String", "nullable": true, "action": "add" },
          { "name": "createdAt", "type": "DateTime", "action": "add" },
          { "name": "updatedAt", "type": "DateTime", "action": "add" }
        ]
      }
    ],
    "flowDescription": "prisma migrate deploy creates the three clinical tables and their indexes on top of the existing tenancy schema; the seed then upserts 3 clinics, 10 doctors, 200 patients and 600 appointments through Prisma; BP-015 to BP-019 query those rows. No existing table or row is altered by the migration."
  },
  "securityConsiderations": [
    {
      "requirementId": "NFR-004",
      "description": "Every clinical table carries clinicId with a foreign key to Clinic, so tenant scoping is a schema guarantee: a query that omits the tenant filter cannot silently join across clinics. The migration is static DDL with no user input and no raw SQL is introduced; all access goes through Prisma's parameterised client (CON-516)."
    },
    {
      "requirementId": "NFR-003",
      "description": "The seed reads DATABASE_URL from the environment only and refuses to run when NODE_ENV=production, so a development fixture cannot be written to a deployed database (CON-519). Every seeded person is fictional - fixed name list, @riaya.local and example.org addresses - and the file header restates CON-506."
    }
  ],
  "performanceConsiderations": [
    {
      "requirementId": "NFR-001",
      "strategy": "The migration is small DDL on three new tables plus two indexes, so migrate deploy on an empty database takes a few hundred milliseconds; the 60-second budget covers CI cold starts rather than the work itself."
    },
    {
      "requirementId": "NFR-003",
      "strategy": "The seed writes 813 rows in sequential upserts inside one transaction, which stays well inside the 60-second budget and leaves no partial state if it fails."
    },
    {
      "requirementId": "NFR-002",
      "strategy": "Additive-only DDL means no table rewrite and no long lock on existing tables, so the migration applies to a populated database without a backfill window."
    }
  ],
  "dependencies": [
    {
      "name": "Prisma",
      "type": "library",
      "action": "no_change",
      "notes": "Already in use; this feature adds models and one migration."
    },
    {
      "name": "PostgreSQL",
      "type": "service",
      "action": "no_change",
      "notes": "Already required and running via docker compose."
    },
    {
      "name": "Deterministic generator (inline)",
      "type": "internal",
      "action": "no_change",
      "notes": "Ships inside the seed file; deliberately not a package, so the supply chain is unchanged."
    }
  ],
  "risks": [
    {
      "description": "The generated migration contains an unexpected destructive statement.",
      "mitigation": "T1.2 reads the emitted SQL before it is committed; DROP or TRUNCATE is a stop condition, not a review note."
    },
    {
      "description": "The in-memory test double drifts from schema.prisma and tests pass against a fiction.",
      "mitigation": "T1.4 adds the same three models to the double in the same change."
    },
    {
      "description": "The seed doubles rows on a second run and inflates the demo dataset.",
      "mitigation": "Upsert on a natural key per entity; T3.2 runs the seed twice and compares counts."
    },
    {
      "description": "The seed runs against a non-development database.",
      "mitigation": "The NODE_ENV guard in T2.2 refuses rather than warns."
    },
    {
      "description": "endsAt > startsAt cannot be expressed in Prisma, so invalid rows become possible later.",
      "mitigation": "EC-003 records the gap and names BP-019 as the owner instead of implying the schema covers it."
    }
  ]
}
